名字,链接,地址,介绍,开放时间,图片链接,评分,建议游玩时间,建议季节,门票,小贴士,Page
万达国际电影城,http://travel.qunar.com/p-oi5236036-wandaguojidianyingcheng,,,,,4.6,,,,,3
赛汗塔拉生态园,http://travel.qunar.com/p-oi39631904-saihantalashengtaiyuan,,,,,0.0,,,,,3
正翔冰雪乐园,http://travel.qunar.com/p-oi39597032-zhengxiangbingxueleyuan,, 尽情欢闹的白雪世界 与其让孩子窝在家里与电子产品为伴 不如来正翔冰雪乐园寻一段奇幻的冰雪奇缘! Are you ready!这里项目巨多! 让你嗨翻天、玩过瘾!只有想不到，没有玩不到! 快来一起来一场欢乐，刺激的冰雪大冒险吧! 让你尽情体验光影中的速度与激情速冻模式即将开始 虽然天气冷但欢乐不能少 激活冬天的不仅有火锅 还有玩雪&戏雪呀! 不来浪一把就不叫过冬 正翔冰雪乐园，交通便捷环境优美，要多爽有多爽,,,0.0,,,,,3
圣鹿源世界鹿文化观光园,http://travel.qunar.com/p-oi39584859-shengluyuanshijieluwen,,鹿城小镇雪乡冰雪节滑雪圈、打雪仗、雪地蹦迪、冰雪表演、全家出游，亲子欢乐多多解锁冬天的n种玩法快来加入狂欢大军  古声古色的北方村落，屋舍俨俨，雪松、栅栏一夜“白头”，大红灯笼高高挂起，暖黄色的火光，给院落增添了几分艳色。,,,0.0,,,,,3
包头市奥林匹克公园,http://travel.qunar.com/p-oi39583889-baotoushiaolinpikegong,,,,,0.0,,,,,3
南海湿地景区-黄金沙滩,http://travel.qunar.com/p-oi39173803-nanhaishidijingqu_huang,,"海滩派对,儿童游乐, 海南风情,亲子休闲、遛娃圣地、周末家庭聚会好去处！海边的快乐根本停不下来！娱乐配套设施拿捏的非常到位！冲呀！大小朋友请就位！南海黄金沙滩向你发来邀请,家长和孩子可以一起参与,不管几岁，快乐万岁！",,,0.0,,,,,3
神鹿草原,http://travel.qunar.com/p-oi39036552-shenlucaoyuan,,景区环境优美，阳光洒在赛汗塔拉草原上，地势平坦而辽阔，露营 星空和美食，这里是天然的游乐园   整个大地都被绿油油的草覆盖着，像一层厚厚的地毯，露营帐篷里仓在草原夜晚的星空 呦呦鹿鸣 ，食野之苹   自然之美，触手可得，逃离城市的喧嚣，把憧憬自由的心灵放飞在这片草原,,,0.0,,,,,3
天禾农业生态庄园,http://travel.qunar.com/p-oi38927535-tianhenongyeshengtaizhuang,,天禾农业生态庄园拥有超多有趣的项目，丰富的亲子活动，块带上孩子来这里过有趣又有意义的周末，大人小孩都能一起参与哦~景区更多好玩活动等您来玩，网红桥，秋千长廊，篝火晚会，玻璃栈道，观光塔，迷宫 浑水摸鱼 沙地淘宝  充气城堡.心动？不如行动。这里不仅仅能让大家亲近自然，能得到舒缓身心的感官收货，更有寓教于乐，乐中施人的人文体验，平时对家人孩子少有的陪伴，能够让你玩一天的庄园就在我们身边哦。当然，您也可以叫上三五个朋友，来这里享受自然地纯净，一起度过...天禾农业生态庄园拥有超多有趣的项目，丰富的亲子活动，块带上孩子来这里过有趣又有意义的周末，大人小孩都能一起参与哦~景区更多好玩活动等您来玩，网红桥，秋千长廊，篝火晚会，玻璃栈道，观光塔，迷宫 浑水摸鱼 沙地淘宝  充气城堡.心动？不如行动。这里不仅仅能让大家亲近自然，能得到舒缓身心的感官收货，更有寓教于乐，乐中施人的人文体验，平时对家人孩子少有的陪伴，能够让你玩一天的庄园就在我们身边哦。当然，您也可以叫上三五个朋友，来这里享受自然地纯净，一起度过惬意的周末时光,,,0.0,,,,,3
酸得甜醋文化博物馆,http://travel.qunar.com/p-oi38915428-suandetiancuwenhuabowu,,酸得甜醋文化博物馆，在这里您可以看得的醋得制作过程，让你亲眼参观到由粮食到醋的演变过程，来到博物馆这里有专业的讲解，让你感受传统的工艺流程，您还可以亲手体验传统工艺，以及进行捞鱼游玩，捞到还可以带走，也为您提供免费的休息区，让您在劳动中体验乐趣，是您家庭娱乐的好去处,,,0.0,,,,,3
维纳度假村,http://travel.qunar.com/p-oi38907923-weinadujiacun,,这里就是你的避暑山庄七彩滑道、沙滩，多功能滑梯、双人滑索、儿童网红桥，空中探险飞渡、离心力飞人，飞跃滑梯，淘气堡，海洋球，蜘蛛塔，攀岩，粘粘墙，空中灌篮，趣味滑索，蹦床，卡丁车等众多项目带给你多种玩乐体验穿梭在五彩缤纷的滑道中眼前的景点不断变换耳边是家人尖叫欢呼声一个字“爽”新颖丰富且有趣的项目带上孩子在里面玩上半天都不会腻,,,0.0,,,,,3
大雁滩景区,http://travel.qunar.com/p-oi38905634-dayantanjingqu,,大雁滩景区位于内蒙古包头市土默特右旗沟门镇境内，北依阴山山脉，南临黄河，地处呼包鄂“金三角”腹地。主要有观景台、中草药种植基地、百花园、采摘园、音乐广场、开心农场、野营烧烤区、百鸟园、童趣乐园、垂钓戏水区、民俗部落、民俗一条街、水上乐园、山体亮化、赵长城遗址及点将台等众多景点。,,,--,,,,,4
包头乐园冰雪嘉年华,http://travel.qunar.com/p-oi38674665-baotouleyuanbingxuejia,,,,,0.0,,,具体收费情况以现场公示为主,,4
包头国际会展管理中心,http://travel.qunar.com/p-oi38341060-baotouguojihuizhanguan,,,,,0.0,,,具体收费情况以现场公示为主,,4
中冶德贤滑雪场,http://travel.qunar.com/p-oi38336331-zhongyedexianhuaxuechang,,"中冶德贤滑雪场，景区为滑雪爱好者提供了专业的滑雪场地，还提供了雪圈，雪地转转，冰车，冰上自行车等游玩项目，还为小朋友准备了儿童戏雪乐园，儿童无动力雪橇，雪地拖拉机小火车等项目，是一家集滑雪，戏雪，为一体的滑雪场。
",,,0.0,建议游览时间：2小时 - 3小时,,,,4
乌素图公园,http://travel.qunar.com/p-oi38335735-wusutugongyuan,,,,,,,,,,4
五当召珍藏瑰宝陈列,http://travel.qunar.com/p-oi38018219-wudangzhaozhenzanggui,"

地址:
包头市石拐区青五线五当沟(距离包头市区约60公里)五当召旅游区内


电话:
0472-8715022,0472-8711568

",五当召珍藏瑰宝陈列展位于包头，这里主要收藏了唐卡、清代瓷器和法器等展品，还有用满、汉、蒙、藏四种文字雕刻的牌匾。,全年 09:00-17:00,,3.9,建议游览时间：2小时 - 3小时,,位于五当召旅游区内，进入需先购买五当召旅游区门票。,,4
横竖街,http://travel.qunar.com/p-oi37807138-hengshujie,,,,,0.0,,,具体收费情况以现场公示为主,,4
柒艺美术馆,http://travel.qunar.com/p-oi37806995-qiyimeishuguan,,,,,0.0,,,具体收费情况以现场公示为主,,4
凯旋南北街,http://travel.qunar.com/p-oi37806801-kaixuannanbeijie,,,,,--,,,具体收费情况以现场公示为主,,4
九曲花街文化大世界,http://travel.qunar.com/p-oi37806439-jiuquhuajiewenhuadashi,,,,,,,,,,4
丝路梦郡,http://travel.qunar.com/p-oi37380588-silumengjun,"

地址:
包头市达尔罕茂名联合旗哈日乌苏嘎查希拉穆仁草原丝路梦郡


电话:
18647150415

",希拉穆仁丝路梦郡景区位于内蒙古包头市达茂旗东南部，是蜚声海内外的避暑胜地希拉穆仁大草原核心旅游区，距离内蒙古自治区首府呼和浩特90公里，是典型的高原草场，每当夏秋时节鲜花缀草、绿莽如茵。景区东临希拉穆仁河，西指草原天鹅湖，不远处的敖伦苏木古城是中世纪欧洲文明传入东方的大城市，更是数百年来草原丝路的重要驿站。驼道漫漫，穿越千年，拂去历史尘埃，丝路梦郡正以崭新的姿态成为希拉穆仁草原上一颗闪亮的明珠。丝路梦郡景区占地3700亩，拥有丝路艺术馆、丝路集市、丝路剧场、丝路非遗街、丝路美食街、丝路餐饮、热气球飞行营地、帐篷营地、研学中心、儿童乐园和新丝路号草原火车等全新体验场所，为游客提供多维度的草原观光及娱乐享受。巨大而洁白的毡包创下希拉穆仁草原毡包面积之最，贯穿景区的风装置景观“腾格里之河”（蒙古语：天空之河）更是随风起舞，绵延飘逸，数百万面寓意祝福和吉祥的风马旗迎风唱诵，给远方游客送来祝福。乘坐热气球空中俯视，更是蜿蜒荡漾，波光粼粼，像一条历史长河从过去流向未来，更似一条圣洁的哈达，代表着草原人民对世界游客的欢迎。,全年 08:30-17:30,,4.0,建议游览时间：3小时 - 4小时,,,,5
战国赵北长城Zhaobei Great Wall of the Warring States Period,http://travel.qunar.com/p-oi35913898-zhanguozhaobeizhangcheng,,,,,--,,,具体收费情况以现场公示为主,,5
内蒙大草原Inner Mongolia Prairie,http://travel.qunar.com/p-oi35913485-neimengdacaoyuan,"

地址:
内蒙古高原东起大兴安岭和苏克斜鲁山，西至甘肃省河西走廊西北端的马鬃山，南沿长城，北接蒙古国


电话:
0472-8313777,4001580472

",,全年 全天开放,,0.0,,,具体收费情况以现场公示为主,,5
九峰山Jiufeng Mountain,http://travel.qunar.com/p-oi35832834-jiufengshan,,九峰山位于阴山山脉中段，由东九峰、西九峰、大西梁、杆林背、羊背山等大小山峰和美岱沟、水涧沟、香桂铺沟等沟堑组成。这里不仅大小山峰峭壁屹立，雄奇伟岸，就是峡谷沟壑，溪流瀑布也很有特点。它雄居土默川平原之北，俯视黄河，悬崖丛生，瀑布飞泻，树茂林深，人们在这里可以尽享大自然之美。九峰山主峰号称“小泰山”，海拔2338米，景区内景色优美，山峰绵延，沟壑纵横，泉水潺潺，沟水常年不断。九峰山险峰众多，从一峰到九峰，山山有特色，峰峰有造型，低的小巧玲珑，高的巍峨壮观。特别是“波光潋滟”的石湖，“一夫当关，万夫莫开”的一线天，以及活灵活现、栩栩如生的卧佛峰、麒麟峰、独树峰，景景美不胜收，让人浮想联翩。,,,--,,,,,5
"希拉穆仁草原乌兰塔拉开心牧场Wulantala Happy Pasture, Xilamuren Grassland",http://travel.qunar.com/p-oi35796070-xilamurencaoyuanwulan,"

地址:
包头市达尔罕茂明安联合旗希拉穆仁镇

",希拉穆仁草原乌兰塔拉开心牧场位于希拉穆仁镇100公里处右侧大苏吉方向，系主题游牧文化，拓展体验营地。整体规划面积500余亩，景区以天然景观为基础，保护和强化景区优美的自然生态环境，融汇“原始生态、非物质文化遗产、蒙古族民俗文化、草原红色文化”等优秀文化理念，是一个集蒙古文化深度体验、夏令营研学、青少年素质教育、草原红色主题宣传、主题线路开发等为一体的综合体验式旅游景区。希拉穆仁草原乌兰塔拉开心牧场功能齐全，主题鲜明，有三宝游牧体验园、欢乐PK竞技场、青葱岁月巴特拓乐园、宝力格人民公社——乌兰塔拉纪念馆，乌兰塔拉小学研学课堂、游牧文化自然体验区、专业拓展营地（毕业墙、信任背摔、珠行万里、同心鼓、不倒森林，动力圈等）、露营烧烤营地提供帐篷、烤炉、土灶、传统竞技项目体验区，草原网红桥、草原那达慕（赛马、马术、马上射箭、摔跤表演、乌兰牧骑演出）等。,全年 09:00-17:00,,2.5,建议游览时间：12小时 - 3天,,具体收费情况以现场公示为主,,5
巴荣陶海Barongtaohai Village,http://travel.qunar.com/p-oi35305996-barongtaohai,,,,,--,,,具体收费情况以现场公示为主,,5
毛岱村Maodai Village,http://travel.qunar.com/p-oi35302734-maodaicun,,,,,--,,,,,5
旧召圪堵Jiuzhaogedu Village,http://travel.qunar.com/p-oi35300943-jiuzhaogedu,,,,,--,,,具体收费情况以现场公示为主,,5
王四顺营村Wangsishunying Village,http://travel.qunar.com/p-oi35289557-wangsishunyingcun,,,,,--,,,具体收费情况以现场公示为主,,5
阿尔善湖生态牧场Aershan Lake Ecological Pasture,http://travel.qunar.com/p-oi35251623-aershanhushengtaimuchang,,,,,--,,,具体收费情况以现场公示为主,,5
赛汗塔拉冰雪文化旅游节,http://travel.qunar.com/p-oi34804321-saihantalabingxuewenhua,"

地址:
包头市九原区赛罕塔拉冰雪嘉年华


电话:
15647247929

",赛汗塔拉冰雪嘉年华将为大家提供多种刺激、网红、趣味的冰雪娱乐设施~畅玩到底~还有大型冰雪音乐节迪士尼冰雪奇缘现场真人秀，嗨爆全城！景区含雪圈体验区、戏雪乐园、冰乐园、雪地足球、雪地迷宫、冰雪动物城、雪雕观赏区等12个项目。快点一起去狂欢吧！,2020年1月10日-3月10日：9:00-21:30,,0.0,建议游览时间：2小时 - 3小时,,68元,,6
达茂旗博物馆Damaoqi Museum,http://travel.qunar.com/p-oi34273918-damaoqibowuguan,"

地址:
包头市达茂旗百灵庙镇广福寺大街草原文化宫

",,周一-周五上午9:00—12:00下午14:30-17:30周六、日（节假日）上午9:00-11:00下午15:00-17:00,,--,,,免费,,6
内蒙古警察博物馆Neimenggu Jingcha Museum,http://travel.qunar.com/p-oi34273589-neimenggujingchabowuguan,"

地址:
呼和浩特市新城区海拉尔大街15号

",,按参观需求不定时开放（主要面向公安机关内部）,,0.0,,,,,6
北方草原文明博物馆Beifang Caoyuan Wenming Museum,http://travel.qunar.com/p-oi34272859-beifangcaoyuanwenming,,,,,--,,,,,6
美岱召博物馆Meidaizhao Museum,http://travel.qunar.com/p-oi34270276-meidaizhaobowuguan,,博物馆位于美岱召前的广场上，馆内展示有很多精美的美岱召壁画，图案各式各样，展品很丰富。,,,3.0,建议游览时间：2小时 - 3小时,,收费,,6
石宝镇农耕文化博物馆Shibaozhen Nonggeng Culture Museum,http://travel.qunar.com/p-oi34269815-shibaozhennonggengwen,"

地址:
包头市达茂旗石宝镇镇区盐房子小区南

",,9:00—16:30，周一全天闭馆（国家法定假日除外）,,--,,,免费,,6
包头星空艺术馆Baotouxingkong Art Museum,http://travel.qunar.com/p-oi32788908-baotouxingkongyishuguan,,在舒适的室内一样可以拍出写真大片的feel，5D唯美星空、40+个展览主题、互动体验式的大型装饰——星空艺术馆空降包头。星光璀璨，如梦如幻，仿佛开启一场星空梦幻之旅，随手一拍就是制霸朋友圈的大片，时而闪烁，时而渐变，让人宛如置身银河，迷失在这片熠熠星光中。在这里，“手可摘星辰”不再是幻想，整个人也跟着blingbling起来。无数的灯盏高低错落地悬挂着，温柔的变幻着色彩，让你一秒陶醉在璀璨的光影森林里，斑斓的灯光不断摇曳变幻，置身于没有边界的光影交错中，随着音乐轻轻舞动。,,,2.7,建议游览时间：1小时 - 3小时,,{'包头星空艺术馆门票学生票\n\n': ['¥35起']},,6
希拉穆仁草原拉托维亚旅游接待点,http://travel.qunar.com/p-oi32309081-xilamurencaoyuanlatuo,"

地址:
包头市达尔罕茂明安联合旗希拉穆仁草原召河召四队

",,全年 全天开放,https://tr-osdcp.qunarzz.com/tr-osd-tr-manager/img/888810de17f3ca8e54ecbc7f9d874f24.jpg_480x360x95_64dc5a29.jpg,5.0,建议游览时间：12小时 - 3天,,参观免费，娱乐项目单独收费，详情以现场公示为准。,,6
梅力更召庙,http://travel.qunar.com/p-oi27587917-meiligengzhaomiao,,,,,--,,,,,6
九峰山林场Jiufengshan Tree Farm,http://travel.qunar.com/p-oi27337423-jiufengshanlinchang,,,,https://tr-osdcp.qunarzz.com/tr-osd-tr-manager/img/315c0e0f262efcf30ed635dc0ce4fc12.jpg_480x360x95_27fb6373.jpg,0.0,建议游览时间：12小时 - 3天,,具体收费情况以现场公示为主,,6
道日布音布拉格,http://travel.qunar.com/p-oi26659016-daoribuyinbulage,,,,,--,,,,,7
德日逊呼都格,http://travel.qunar.com/p-oi26648605-derixunhudouge,,,,,--,,,,,7
哈交呼都格,http://travel.qunar.com/p-oi26648318-hajiaohudouge,,,,,--,,,,,7
阿思根牧场,http://travel.qunar.com/p-oi26638658-asigenmuchang,,,,,--,,,,,7
美岱桥民俗馆,http://travel.qunar.com/p-oi26579097-meidaiqiaominsuguan,,,,,--,,,,,7
诗画草原旅游景区Shihua Grassland,http://travel.qunar.com/p-oi26577475-shihuacaoyuanlu:youjing,"

地址:
达茂联合旗巴音敖包苏木达布希拉图嘎查168号


电话:
4006602225

",诗画草原旅游景区位于达茂旗巴音敖包苏木达布希拉图嘎查（百灵庙镇至额尔登敖包16公里处），是草原自驾游、草原深度体验、蒙元风情度假等民族特色旅游的好去处。诗画草原旅游景区海拔较高，地势平坦，广袤辽阔，拥有天然草场10万亩。景区现建有大型宴会包、餐饮包、商务餐饮包、住宿包，及可容纳500余人同时就餐的玻璃自助餐厅。建有涵盖智能服务管理、信息咨询发布、游客集散休闲、主题练歌观影等人性化贴心功能的游客服务中心。同时配套有祭祀敖包、篝火广场、房车营地、文旅产业园区、大型动物观赏园、牧民生活体验区、休闲娱乐区、风情烧烤体验区、民族特产超市等附属参观及服务设施。,全年 08:00-20:00,,4.5,,,景区内游玩项目单独收费。,,7
包头古城文化旅游区Baotou Ancient City Cultural Tourist Area,http://travel.qunar.com/p-oi26577305-baotouguchengwenhualu:,,包头古城文化旅游景区位于包头市石拐区喜桂图新区，以“西北民俗风情、重现老包头文化”为主题，包括农耕文化观光、传统手工坊、民俗美食街、民俗工艺街、梯田体验设施、乡村大舞台、多项现代时尚游乐设施、蒙元文化体验区、景区服务、民俗体验、动物观赏等。黄土为墙、青砖为体、茅草为屋、红灯为饰，没有华丽的装扮，包头古城以原汁原味的黄土地文化以穿越时空的姿态再现了塞外农耕文化的风土人情。,,,4.0,建议游览时间：12小时 - 3天,,{'包头古城文化旅游区电子导览票大小同价\n\n': ['¥7起']},,7
中国黄河湿地博物馆鸟类图片馆China Yellow River Wetland Museum Birds Photo Gallery,http://travel.qunar.com/p-oi25215347-zhongguohuangheshidibo,,,,,,,,,,7
恩格贝展览馆Engebei Exhibition Center,http://travel.qunar.com/p-oi24441662-engebeizhanlanguan,,,,,0.0,,,具体收费情况以现场公示为主,,7
娜琳步行街NaLin BuXingJie,http://travel.qunar.com/p-oi24441129-nalinbuxingjie,,娜琳步行街位于包头市青山区，这是商品众多，环境干净，是购物，娱乐的好去处。,,https://tr-osdcp.qunarzz.com/tr-osd-tr-manager/img/b370822b9fa35710db284f6ab8e6aecb.jpg_480x360x95_7ec4d836.jpg,5.0,建议游览时间：3小时,,,,7
民族东路美食街MinZu DongLu MeiShiJie,http://travel.qunar.com/p-oi24441128-minzudonglumeishijie,,,,,4.7,,,具体收费情况以现场公示为主,,8
金世纪商业街JinShiJi ShangYeJie,http://travel.qunar.com/p-oi24441127-jinshijishangyejie,,,,,--,,,具体收费情况以现场公示为主,,8
鹿城新天地LuCheng XinTianDi,http://travel.qunar.com/p-oi24441125-luchengxintiandi,,,,https://tr-osdcp.qunarzz.com/tr-osd-tr-manager/img/45831e616c8605caca30a0bddd2dc1a0.jpg_480x360x95_0a1b790e.jpg,5.0,,,具体收费情况以现场公示为主,,8
九原步行街JiuYuan BuXingJie,http://travel.qunar.com/p-oi24441124-jiuyuanbuxingjie,,,,,--,,,具体收费情况以现场公示为主,,8
光彩商业街GuangCai ShangYeJie,http://travel.qunar.com/p-oi24441115-guangcaishangyejie,,,,,--,,,,,8
东河食品街DongHe ShiPin Jie,http://travel.qunar.com/p-oi24441112-dongheshipinjie,,,,,--,,,具体收费情况以现场公示为主,,8
包百商业步行街BaoBai ShangYe BuXingJie,http://travel.qunar.com/p-oi24441103-baobaishangyebuxingjie,,,,,4.5,,,具体收费情况以现场公示为主,,8
包头温州步行街Baotou WenZhou BuXingJie,http://travel.qunar.com/p-oi24439596-baotouwenzhoubuxingjie,,,,,4.0,,,具体收费情况以现场公示为主,,8
现代城家装艺术街XianDai ChengJiaZhuang YiShu Jie,http://travel.qunar.com/p-oi24439505-xiandaichengjiazhuang,,,,,--,,,,,8
中央大道商业步行街ZhongYang DaDao ShangYe BuXingJie,http://travel.qunar.com/p-oi24437357-zhongyangdadaoshangye,,,,,--,,,具体收费情况以现场公示为主,,8
达茂草原Damao Grassland,http://travel.qunar.com/p-oi24411355-damaocaoyuan,"

地址:
百灵庙镇以北

",,全年 全天开放,,--,,,具体收费情况以现场公示为主,,9
九曲黄河Jiuqu Yellow River,http://travel.qunar.com/p-oi24411322-jiuquhuanghe,"

地址:
东河区南海旅游开发区

",九曲黄河是指流经的九个省区以及每个省区的各个渡口而闻名。九曲黄河所在的旅游开发区以水上活动和湖滨游览为主供游客游玩观赏。,全年 全天开放,https://tr-osdcp.qunarzz.com/tr-osd-tr-manager/img/9430d6cb5c2b0bb6f87031c77bddaa94.jpg_480x360x95_6639b8cc.jpg,1.0,建议游览时间：1小时 - 3小时,,具体收费情况以现场公示为主,,9
香港皇嘉蜡像馆Hong Kong Huangjia Wax Museum,http://travel.qunar.com/p-oi23352336-xiangganghuangjialaxiang,"

地址:
包头市青山区钢铁大街7号北京华联5楼中厅（正翔国际店）

",位于包头市青山区北京华联5楼中厅（正翔国际店）内的香港皇嘉蜡像馆是一个与诸多“男神”“女神”零距离接触的好地方，馆内设有音乐梦工厂、抖音专区、惊悚恐怖区、漫威英雄区等七个主题展区，共有50余尊名人蜡像亮相。栩栩如生的名人蜡像毫发毕现，令观者印象深刻。,9:30-21:30,,1.0,建议游览时间：2小时 - 3小时,,具体收费情况以现场公示为主,,9
希拉穆仁花海Xilamuren Flower Sea,http://travel.qunar.com/p-oi23344462-xilamurenhuahai,,花海位于希拉穆仁草原，花海的面积很大，可以在花丛中拍照，还可以骑自行车徜徉在花海中，景区里除了花海之外，还有水上乐园和热气球等游玩项目，既有趣又刺激。,,https://img1.qunarzz.com/piao/fusion/2105/9d/f101d5bb8ae69402.jpg_480x360x95_881c84c6.jpg,5.0,建议游览时间：2小时 - 3小时,,具体收费情况以现场公示为主,,9
商会文化广场Shanghui Culture Square,http://travel.qunar.com/p-oi23343264-shanghuiwenhuaguangchang,,,,,--,,,具体收费情况以现场公示为主,,9
转龙藏Zhuanlongcang Scenic Area,http://travel.qunar.com/p-oi23342380-zhuanlongzang,,,,https://tr-osdcp.qunarzz.com/tr-osd-tr-manager/img/3aeada0128566f26832a02c88028a444.jpg_480x360x95_5dc35655.jpg,0.0,,,,,9
乔家金街Qiaojiajin Street,http://travel.qunar.com/p-oi23341480-qiaojiajinjie,"

地址:
包头市东河区财神庙与吕祖庙之间

",乔家金街是包头早期的文化商贸聚集地，整体蒙晋建筑颇具特色。现在的乔家金街老牌林立，古玩、戏园、美食等交织一起相得益彰，构成一个全新的格局。,全年 全天开放,https://flight-feed.qunarzz.com/as3/180/image/poi_vishnu/3f82f62a-559e-428f-a480-5873591d7ac6.jpg,3.9,建议游览时间：2小时 - 3小时,,具体收费情况以现场公示为主,,9
莲花山景区Lianhua Mountain Sceneic Area,http://travel.qunar.com/p-oi20977977-lianhuashanjingqu,,莲花山景区位于包头市东河区沙尔沁镇。莲花山景区原名为大青山旅游区，自古以来人杰地灵，风光旖旎，主峰山腰环绕的香柏群落自然组成了一幅“鹿回头”的图案，远远望去，栩栩如生。今日，莲花山以生态旅游度假为特色，以山体风光、商务度假和食宿体验等为主线，塑造了“莲花圣境，养生福地”，成为了人们休闲旅游的好地方。,,https://tr-osdcp.qunarzz.com/tr-osd-tr-manager/img/54ab1ee68652ec05c3c7d29849c198b9.jpg_480x360x95_f8269193.jpg,4.3,建议游览时间：12小时 - 3天,,具体收费情况以现场公示为主,,9
达茂联合旗希拉穆仁庙Damao Lianheqi Xila Muren Temple,http://travel.qunar.com/p-oi20001467-damaolianheqixilamuren,,,,,4.0,,,具体收费情况以现场公示为主,,9
青山公园Qing Mountain Park,http://travel.qunar.com/p-oi20001255-qingshangongyuan,,,,,--,,,具体收费情况以现场公示为主,,9
东方明珠休闲广场Dongfangmingzhu Leisure Square,http://travel.qunar.com/p-oi20001141-dongfangmingzhuxiuxian,,,,https://tr-osdcp.qunarzz.com/tr-osd-tr-manager/img/bf04bd777c543afd5764e603de531f3c.jpg_480x360x95_35ef4f8d.jpg,--,,,,,10
青山区天主教堂Qingshan Catholic Cathedral (Southeast First Gate),http://travel.qunar.com/p-oi20001048-qingshanqutianzhujiao,,,,,,,,,,10
一机广场Yiji Square,http://travel.qunar.com/p-oi20001046-yijiguangchang,,,,,--,,,具体收费情况以现场公示为主,,10
林荫广场Linyin Square,http://travel.qunar.com/p-oi20001038-linyinguangchang,,,,,--,,,具体收费情况以现场公示为主,,10
廉政公园Lianzheng Park,http://travel.qunar.com/p-oi20001032-lianzhenggongyuan,,,,,--,,,具体收费情况以现场公示为主,,10
世纪广场(市府东路)Shiji Square,http://travel.qunar.com/p-oi20001008-shijiguangchang,,,,,--,,,具体收费情况以现场公示为主,,10
富民广场Guyang Fumin Square,http://travel.qunar.com/p-oi20000978-fuminguangchang,,,,https://tr-osdcp.qunarzz.com/tr-osd-tr-manager/img/daca357a215c361821085ece0ec9e3aa.jpg_480x360x95_4216709e.jpg,--,建议游览时间：1小时 - 2小时,,,,10
清真西寺Muslim Xisi,http://travel.qunar.com/p-oi20000964-qingzhenxisi,,,,,0.0,,,具体收费情况以现场公示为主,,10
阿伦斯木古城遗址Alunsimu Ancient City Relic Site,http://travel.qunar.com/p-oi20000951-alunsimuguchengyizhi,,,,,--,,,具体收费情况以现场公示为主,,10
