名字,链接,地址,介绍,开放时间,图片链接,评分,建议游玩时间,建议季节,门票,小贴士,Page
韶峰Shaofeng Peak,http://travel.qunar.com/p-oi35216728-shaofeng,"

地址:
韶峰景区


电话:
0731-55685343

",韶峰是衡山山脉第七十一峰，韶山第一高峰，又名仙顶灵峰，因有“韶乐”的传说，故又被称作“音乐之峰”。韶峰风景秀丽，古有八景：韶峰耸翠、胭脂古井、顿石成门、石屋青风、塔岭晴霞、仙女茅庵、凤仪亭址、石壁流水。古人赞叹韶峰是：“从来仙境称韶峰，笔削三山插天空。天下名山三百六，此是江南第一仑。”韶峰群山环抱、茂竹修林，整个山峰俏丽俊秀、松柏成林，《清潭县志》中记载：桓氏三女从长沙来，择此筑庵，静心修炼，乃白日升仙。这一说使韶峰披上了神秘的色彩，同时也使这充满刚阳之气的山峰，带上了女性的阴柔之美。韶峰耸翠是八景中的第一景，登高遥望，将韶山的美景尽收眼底，令人心旷神怡。,全年 08:00-17:00,,5.0,建议游览时间：12小时 - 3天,,,,6
韶峰景区Shaofeng Sceneic Area,http://travel.qunar.com/p-oi35215826-shaofengjingqu,,,,,,,,,,6
大杰寺Dajie Temple,http://travel.qunar.com/p-oi35214843-dajiesi,,,,,--,,,,,7
毛主席纪念馆Maozhuxi Memorial Hall,http://travel.qunar.com/p-oi35214194-maozhuxijinianguan,,,,,0.0,建议游览时间：1小时 - 2小时,,,,7
金霞山森林公园Jinxia Mountain Forest Park,http://travel.qunar.com/p-oi35214179-jinxiashansenlingongyuan,,,,,,,,,,7
中共韶山特别支部历史陈列馆Zhonggong Shao Shan Tebie Zhibu Lishi Exhibition Hall,http://travel.qunar.com/p-oi34270029-zhonggongshaoshantebie,"

地址:
韶山市韶山冲

",,闭馆提质改造,,0.0,建议游览时间：2小时 - 3小时,,免费,,7
谭政故居Tanzheng Former Residence,http://travel.qunar.com/p-oi32826662-tanzhengguju,,谭政故居位于湘乡市，群山环绕，环境优美，百多间土木结构的大院错落有致，分布均匀，是一座典型的江南大农舍。,,https://tr-osdcp.qunarzz.com/tr-osd-tr-manager/img/034f6514f6a3525b181d26c72d1690fd.jpg_480x360x95_9996b8e6.jpg,3.0,建议游览时间：1小时 - 2小时,,具体收费情况以现场公示为主,,7
矿山公园Kuang Mountain Park,http://travel.qunar.com/p-oi32808946-kuangshangongyuan,,矿山公园位于湘潭市雨湖区，由矿区改造而成，绿化率高，树木丛生，百草丰茂，景色优美。,,https://tr-osdcp.qunarzz.com/tr-osd-tr-manager/img/7f23f41317a4c612b6781f19c1269932.jpg_480x360x95_7237f7a2.jpg,4.0,建议游览时间：2小时 - 3小时,,具体收费情况以现场公示为主,,7
东方博物馆Dongfang Museum,http://travel.qunar.com/p-oi29812436-dongfangbowuguan,,东方博物馆为邮票主题博物馆，整个布局为六馆一厅，包括毛主席及红色文化珍邮馆，祖国万岁系列珍邮馆，中国交通票证馆及世界各国早期珍邮馆等。馆内收藏了约5万枚中国民间红色珍邮，见证了中国的红色发展历程。除此之外，还能在该馆还能见识到200个国家和地区发行的第1枚邮票哦。,,,0.0,,,具体收费情况以现场公示为主,,7
万楼Wenchang Tower,http://travel.qunar.com/p-oi29541288-wanlou,"

地址:
万楼街道沿江中路


电话:
18711315155

",万楼，又名文昌阁，位于湘潭市雨湖区。万楼始建于明朝万历四十三年，时任京官李腾芳为其取名为万楼，寓意为“万，乃数之大者，邑从此而大”。古代湘潭的文人墨客常聚于此，登楼观景吟诗作赋。,8:00-17:30，16:30停止入场。内部景点开放时间详见景区公示。,,4.0,建议游览时间：1小时 - 2小时,,具体收费情况以现场公示为主,,7
湘潭璀璨星空艺术馆Xiangtan Cuican Xingkong Art Museum,http://travel.qunar.com/p-oi27347297-xiangtancuicanxingkong,,湘潭璀璨星空艺术馆位于湖南省湘潭市雨湖区车站路1号城市盒子6楼，设计非常的梦幻，给人星空漫步的梦幻感，灯光绚丽，富有浪漫气息，适合情侣、亲子游玩。,,,3.0,建议游览时间：1小时 - 2小时,,48元,,7
碧洲公园Bizhou Park,http://travel.qunar.com/p-oi27336728-bizhougongyuan,"

地址:
滨河路

",,全年 全天开放,,0.0,,,,,7
高叶冲Gaoyechong Village,http://travel.qunar.com/p-oi26958881-gaoyechong,,,,,--,,,具体收费情况以现场公示为主,,8
湖南水府庙国家湿地公园Hunan Shuifumiao National Wetland Park,http://travel.qunar.com/p-oi26663089-hunanshuifumiaoguojia,,水府庙国家湿地公园占地面积广，是湘中地区规模较大、保存较完整的人工与天然巧妙结合的城郊湿地。这里动植物资源丰富，还有宋窑遗址博物馆、陈赓故居等景点。,,,4.0,建议游览时间：2小时 - 3小时,,,,8
马鞍山林场,http://travel.qunar.com/p-oi26645185-maanshanlinchang,,,,,--,,,,,8
潭市商业街TanShi ShangYe Jie,http://travel.qunar.com/p-oi24439865-tanshishangyejie,,,,,--,,,具体收费情况以现场公示为主,,8
云门步行街YunMen BuXingJie,http://travel.qunar.com/p-oi24439862-yunmenbuxingjie,,,,,--,,,具体收费情况以现场公示为主,,8
伏虎商业街FuHu ShangYe Jie,http://travel.qunar.com/p-oi24439856-fuhushangyejie,,,,,5.0,,,具体收费情况以现场公示为主,,8
湘潭市群艺馆河东分馆XiangTanShi QunYiGuan HeDong FenGuan,http://travel.qunar.com/p-oi24439852-xiangtanshiqunyiguanhe,,,,,--,,,具体收费情况以现场公示为主,,8
湘江名城宣华展示中心XiangJiang MingCheng XuanHua ZhanShi ZhongXin,http://travel.qunar.com/p-oi24439845-xiangjiangmingchengxuan,,,,,--,,,,,8
盘龙商业街PanLong ShangYeJie,http://travel.qunar.com/p-oi24439844-panlongshangyejie,,,,,--,,,,,8
华隆商业街HuaLong ShangYeJie,http://travel.qunar.com/p-oi24439840-hualongshangyejie,,,,,5.0,,,具体收费情况以现场公示为主,,8
城市盒子情景购物街ChengShi HeZi QingJing GouWu Jie,http://travel.qunar.com/p-oi24439835-chengshiheziqingjinggou,,,,,--,,,具体收费情况以现场公示为主,,9
褚公祠Chugong Ancestral House,http://travel.qunar.com/p-oi24413065-chugongci,,"褚公祠位于湘乡，是为纪念唐代书法家褚遂良而建，门廊左侧的石幢，建于1321年，高约2米，四面各宽0.6米，非常珍贵。
",,https://tr-osdcp.qunarzz.com/tr-osd-tr-manager/img/54850e426f6d90dc2b02a66f0fcad81e.jpg_480x360x95_9c403632.jpg,3.7,建议游览时间：1小时 - 2小时,,具体收费情况以现场公示为主,,9
褒忠山Baozhong Mountain,http://travel.qunar.com/p-oi24412999-baozhongshan,,褒忠山山势起伏，蜿蜒曲折，林木参天，枝叶交错，植被覆盖率高。市民可以在这里领略大自然的美景，享受休闲慢生活。,,https://tr-osdcp.qunarzz.com/tr-osd-tr-manager/img/4aabb481736e1ab83069b4da6db1b185.jpg_480x360x95_bde75414.jpg,4.7,建议游览时间：12小时 - 3天,,具体收费情况以现场公示为主,,9
陶公山Mt. Taogong Scenic Resort,http://travel.qunar.com/p-oi24412861-taogongshan,,,,,,,,,,9
黄土山Huangtu Mountain,http://travel.qunar.com/p-oi24412765-huangtushan,,,,,--,,,具体收费情况以现场公示为主,,9
黄公略铜像Bronze Statue of Huang Gonglve,http://travel.qunar.com/p-oi24412759-huanggonglu:etongxiang,,,,,--,,,具体收费情况以现场公示为主,,9
碧泉潭Biquan Lake,http://travel.qunar.com/p-oi24412697-biquantan,,这里的碧泉水终年保持在20℃左右。让人感到凉气袭人，清爽适身。冬天的适合则热气蒸腾 。,,https://tr-osdcp.qunarzz.com/tr-osd-tr-manager/img/58c11467c73d6685ba45eaa7055505ac.jpg_480x360x95_e5096b05.jpg,0.0,建议游览时间：2小时 - 3小时,,具体收费情况以现场公示为主,,9
石鱼山Shiyu Mountain,http://travel.qunar.com/p-oi24412546-shiyushan,"

地址:
湖南省湘乡市湖山乡

",,全年 9:00-23:00,,--,,,,,9
伏虎古井Fuhu Ancient Well,http://travel.qunar.com/p-oi24412527-fuhugujing,,,,,--,,,具体收费情况以现场公示为主,,9
晓霞山Xiaoxia Mountain,http://travel.qunar.com/p-oi24409911-xiaoxiashan,,,,,--,,,具体收费情况以现场公示为主,,9
周小舟故居Former Residence of Zhouxiaozhou,http://travel.qunar.com/p-oi23351563-zhouxiaozhouguju,,周小舟故居位于湘潭市，隐山东南麓。始建于1805年，为一土砖瓦房，建筑面积约800多平方米，大小房屋30多间，属于典型旧式湘潭民居。故居坐西北朝东南，依山面塘，规模比一般的民居大两倍。故居建筑自左至右共有9弄相连，每弄有3-4进，堂屋两侧厢房有左、右两个天井，夹在其他房间的中间，以房顶安装“采光斗”采光，是既不靠外墙，又不靠天井的“聋子屋”。,,https://tr-osdcp.qunarzz.com/tr-osd-tr-manager/img/702a28c40d492c5c9cb35c1f7edc0eab.jpg_480x360x95_e46a38dc.jpg,5.0,建议游览时间：2小时,,,,10
窑湾老街Yaowanlao Street,http://travel.qunar.com/p-oi23343133-yaowanlaojie,,窑湾老街周围是仿古建筑，具备独特的历史人文景观，是人们旅游度假的好去处。,,https://tr-osdcp.qunarzz.com/tr-osd-tr-manager/img/523147a9960b94ccd6607bf8d48b62a4.jpg_480x360x95_e9b3edca.jpg,4.3,建议游览时间：2小时 - 3小时,,具体收费情况以现场公示为主,,10
松山一号楼Songshan No.1 Building,http://travel.qunar.com/p-oi23342747-songshanyihaolou,,在一片苍松翠竹之中，沿路而上，经过一座小桥，由此进入松山。在竹林中显出一圆形拱门，这就是松山一号了。从拱门进去，只见古松遮天盖日，樟木苍翠欲滴，小鸟林间欢唱，微风迎面送来阵阵幽香。松山一号楼就在这里依山傍水而立，名为楼，实为青砖青瓦外普通的平房。一号楼建于1958年，面积500多平方米，有卧室、会客室、理发室、餐厅、娱乐室等，所有设施一应俱全。,,,3.0,建议游览时间：0.5小时 - 1小时,,,,10
南岸私塾Nan'an Old-style Private School,http://travel.qunar.com/p-oi23342744-nanansishu,,南岸私塾建于清代，旧址位于故居西侧。现经过全面维修，依旧白墙青砖保持着当年的原貌。,,https://tr-osdcp.qunarzz.com/tr-osd-tr-manager/img/a64bf8392455262b709223fe17e9b024.jpg_480x360x95_c22007b4.jpg,4.0,建议游览时间：1小时 - 2小时,,,,10
毛震公祠Maozhen Temple,http://travel.qunar.com/p-oi23342741-maozhengongci,,,,,4.5,建议游览时间：1小时 - 2小时,,,,10
"宝塔岭高峰塔Gaofeng Tower, Baota Hillside",http://travel.qunar.com/p-oi23342644-baotalinggaofengta,,湘潭宝塔岭高峰塔始建于明万历42年（公元1615年），文革被毁，1994年重修，位于湘潭开发区红旗商贸城附近，107国道在此旁经过。面对湘江，在湘潭湘江一大桥和三大桥中间。,,,--,,,具体收费情况以现场公示为主,,10
鲁班殿Luban Palace,http://travel.qunar.com/p-oi23342643-lubandian,,,,,--,,,具体收费情况以现场公示为主,,10
望衡亭Wangheng Pavilion,http://travel.qunar.com/p-oi23342642-wanghengting,,,,https://tr-osdcp.qunarzz.com/tr-osd-tr-manager/img/dc02d85cd1ce22eb74a6f263e35db368.jpg_480x360x95_37ce3d7b.jpg,--,,,具体收费情况以现场公示为主,,10
君子莲雕塑Lotus Sculpture,http://travel.qunar.com/p-oi23342641-junziliandiaosu,,,,,--,,,具体收费情况以现场公示为主,,10
唐兴寺Tangxing Temple,http://travel.qunar.com/p-oi23060043-tangxingsi,,,,,--,,,具体收费情况以现场公示为主,,10
