名字,链接,地址,介绍,开放时间,图片链接,评分,建议游玩时间,建议季节,门票,小贴士,Page
和平公园Peace Park (Southwest Gate),http://travel.qunar.com/p-oi715612-hepinggongyuan,"

地址:
湘潭市雨湖区建设北路278号


电话:
0731-58224971

",和平公园主要以独特的森林气候、优雅的自然环境为景观的公共憩地，园内已植梓、樟、楠与玉兰、银杏等乔木100多种、地栽盆景花卉、丝竹600余种、4万多种。陆地覆盖率已达80％以上，占总面积70％以上为林地，突出了公园以“绿”为主的特点与功能。园内的主要景点有：盆景园、动物园、旱冰埸、百花台、儿童游乐园别具特色，大型电动飞机、秋千、吊环、座栏、溜溜板、碰碰车等设施于绿树丛中，环境优雅，空气清新。和平公园培植制作的花卉、盆景，已在全国初露头角。全国花卉、中国盆景协会于1992年在上海举行首届菊花展览，和平公园送展的礼菊“二龙戏珠”荣获一等奖。1985、1986年湖南省多数获奖。1986年4月，中共中央顾委王首道视察和平公园，称赞该园盆景江南风味浓，并为盆景园手书了“湘潭盆景”匾额。,全年 全天开放,https://img1.qunarzz.com/travel/poi/1803/10/0c8fc3736c9ed537.jpg_480x360x95_4285c5e5.jpg,4.4,建议游览时间：1小时,,具体收费情况以现场公示为主,,2
毛泽东遗物馆,http://travel.qunar.com/p-oi705808-maozedongyiwuguan,,毛泽东遗物馆总建筑面积1．9万平方米，馆内辟有《风范长存——毛泽东遗物展》《毛泽东主席生活用瓷展》《毛泽东珍藏唱片磁带展》《韶山毛泽东同志纪念馆珍藏艺术品展》等四个陈列，共展示毛泽东遗物1008件。走进毛泽东遗物馆，毛泽东手迹“为人民服务”映入眼帘，接着是遗物馆的主体陈列《风范长存——毛泽东遗物展》，陈列面积2000多平方米，分“勤政为民、鞠躬尽瘁”“反奢倡俭、清廉如水”“博学多思、孜孜不倦”“亲情如歌、友谊似海”“雅情逸趣、坦荡襟怀”五个部分，真实再现...毛泽东遗物馆总建筑面积1．9万平方米，馆内辟有《风范长存——毛泽东遗物展》《毛泽东主席生活用瓷展》《毛泽东珍藏唱片磁带展》《韶山毛泽东同志纪念馆珍藏艺术品展》等四个陈列，共展示毛泽东遗物1008件。走进毛泽东遗物馆，毛泽东手迹“为人民服务”映入眼帘，接着是遗物馆的主体陈列《风范长存——毛泽东遗物展》，陈列面积2000多平方米，分“勤政为民、鞠躬尽瘁”“反奢倡俭、清廉如水”“博学多思、孜孜不倦”“亲情如歌、友谊似海”“雅情逸趣、坦荡襟怀”五个部分，真实再现了毛泽东日常生活的真实景况。其中，多件毛泽东书信及诗词手迹，均是第一次公开披露。毛泽东遗物馆的文物库房还收藏和保护遗物6536件。馆内陈列的毛泽东遗物，反映出一代伟人俭朴、节约的生活习惯。一件伴随毛泽东走过晚年岁月、打了73个补丁的睡衣，令无数参观展览的游客为之动容。毛泽东理发用的理发工具箱也是首次与游客见面，木梳子、手推剪、剃刀等老式理发工具，更是让游客感慨万千。展品中还有一组日常用品：牙刷四支、牙粉三瓶、牙膏一支、搪瓷缸两个，均为原物。遗物馆还展出了毛主席生前的一本生活账目，记录了“还钱”给章士钊的明细：毛泽东为感谢章士钊上世纪20年代初筹款资助革命的义举，从1963年开始，以“还钱”的名义每年从自己的稿费中拿出2000元给章士钊，帮助其补贴家用。,,https://tr-osdcp.qunarzz.com/tr-osd-tr-mapi/img/0f811c89e290439a43df47cfa1ac4d9f.jpg_480x360x95_fc43ab79.jpg,3.5,,,,,2
彭德怀纪念馆,http://travel.qunar.com/p-oi713387-pengdehuaijinianguan,,纪念园位于湘潭乌石镇，依山而建，有纪念馆，铜像广场，铜像雕塑，德怀亭，德怀墓等景点。,,https://img1.qunarzz.com/travel/d5/1606/81/674d6d0379b5adf7.jpg_480x360x95_76a68530.jpg,5.0,建议游览时间：1小时 - 2小时,,具体收费情况以现场公示为主,,2
宝塔岭高峰塔,http://travel.qunar.com/p-oi701881-baotalinggaofengta,,湘潭宝塔岭高峰塔始建于明万历42年（公元1615年），文革被毁，1994年重修，位于湘潭开发区红旗商贸城附近，107国道在此旁经过。面对湘江，在湘潭湘江一大桥和三大桥中间。,,https://img1.qunarzz.com/travel/d1/1506/5b/7567f213d70294.jpg_480x360x95_fd881d3f.jpg,3.8,,,,,2
韶山烈士陵园,http://travel.qunar.com/p-oi719384-shaoshanlieshilingyuan,,韶山烈士陵园为了纪念英勇献身的韶山英烈，为了让现实永远记住历史，韶山人民在毛泽东诞生百周年之际，建起了一座气势雄伟的韶山烈士陵园，以人微言轻永久的祭奠。韶山烈士陵园位于韶山市政府所在地清溪镇。在韶山冲东北口，在韶峰东北口，在韶峰东麓，新辟了一条宽40米，长1020米林荫大道，这便是英雄路。英雄路北端与毛泽东青年时代塑像广场相通，南端即是天鹅山，韶山烈士陵园就建在天鹅山上。 这是一座没有灵柩的陵园，因为英烈们当年或捐躯在外，或身首异处，人们不忍再打搅他...韶山烈士陵园为了纪念英勇献身的韶山英烈，为了让现实永远记住历史，韶山人民在毛泽东诞生百周年之际，建起了一座气势雄伟的韶山烈士陵园，以人微言轻永久的祭奠。韶山烈士陵园位于韶山市政府所在地清溪镇。在韶山冲东北口，在韶峰东北口，在韶峰东麓，新辟了一条宽40米，长1020米林荫大道，这便是英雄路。英雄路北端与毛泽东青年时代塑像广场相通，南端即是天鹅山，韶山烈士陵园就建在天鹅山上。 这是一座没有灵柩的陵园，因为英烈们当年或捐躯在外，或身首异处，人们不忍再打搅他们的在天之灵。人们只是以塔、亭、馆、台、群雕等等熔铸古今建筑艺术的形式来表达隆重的祭奠。,,,3.0,,,,,2
湘潭农博园Xiangtan Agriculture Expo Garden,http://travel.qunar.com/p-oi722379-xiangtannongboyuan,"

地址:
湘潭市湘潭县泉塘子乡境内320国道附近


电话:
0732-7333333

",湘潭农博园位于湘潭市西郊的泉塘子，是湘潭进行农业科技交流、会议培训的农业科技示范基地，又是一处陶冶情操、健身娱乐的休闲场所。农博园分为农业科技示范区、绿色食品开发区和农业旅游度假区三个区域。农业旅游度假区以白鹭湖度假村为主体，区内山水相连，碧水如镜，松涛如潮，风景优美。农业科技示范区以泉塘子农技站为主体，长年试验、示范用地550亩。泉塘子农技站是国家杂交水稻研究中心中试基地、袁隆平成果转化基地、隆平高科示范基。绿色食品开发区以湘潭市原种场为主体，区内田成格、路成型、树成行、渠成网，呈现出现代农业的架构。,全年 全天开放,https://img1.qunarzz.com/travel/poi/1803/53/85a3a67d7a2c2337.jpg_480x360x95_9b3026a0.jpg,4.5,建议游览时间：3天,,具体收费情况以现场公示为主,,2
黄公略同志故居Former Residence of Huang Gonglve,http://travel.qunar.com/p-oi706763-huanggonglu:etongzhigu,"

地址:
湘潭市湘乡市中沙镇桂花分朝阳村高木冲


电话:
0731-56820214

",在湖南省湘乡市，有一栋百年古朴的江南民宅，它就是红军将领黄公略的故居。故居前面有满塘的荷花，后面是大山。风景优美，环境宁静。,8:00-17:30,https://tr-osdcp.qunarzz.com/tr-osd-tr-manager/img/e51622f109514237f4500b174728d1ee.jpg_480x360x95_0dca9459.jpg,4.7,建议游览时间：1小时 - 2小时,,具体收费情况以现场公示为主,,2
齐白石纪念馆Qibaishi Memorial Hall,http://travel.qunar.com/p-oi705624-qibaishijinianguan,"

地址:
湘潭市雨湖区大湖路


电话:
0731-58222741,0731-58552780

",齐白石纪念馆位于湘潭市白马湖风景区。为纪念杰出的人民艺术家、世界文化名人齐白石，1983年中宣部、文化部批准在湘潭修建齐白石纪念馆，历时10年，于1993年竣工落成，同年五月二十三日举行开馆庆典。馆址用地10000平方米，主体建筑2000平方米。馆内收藏齐白石国画作品和早期雕花作品数十件并收藏了近、当代名家书画作品数百件。纪念馆周围风景秀丽，是湘潭市的文物保护单位。,周二-周日9:00-17:00，16:30停止入场。周一闭馆。,https://tr-osdcp.qunarzz.com/tr-osd-tr-manager/img/27a1c08d85d4449318993c04f0f6e052.jpg_480x360x95_ee929c68.jpg,4.5,建议游览时间：1小时,,具体收费情况以现场公示为主,,2
毛泽东诗词碑林Shaoshan Mao Zedong's Poetry Forest of Stone Tablets,http://travel.qunar.com/p-oi710839-maozedongshicibeilin,"

地址:
湘潭市韶山市韶峰半山腰


电话:
0731-55685343,0731-55685445

",毛泽东诗词碑林位于风景秀丽的韶峰半山腰，占地2万平方米，由100块汉白玉、花岗岩、大理石碑组成，按照毛泽东的革命生涯分为5个部分，按照时间顺序分为4个时期共收录毛泽东诗词100首，以纪念毛主席诞生100周年。碑林设计新颖、气势宏伟，100块诗词碑形状各异、依山走势、错落有致、雕刻精美，与毛泽东诗词的博大精深、雄浑气势相结合，又与韶峰的自然美景相辅相成，浑然一体，让人流连忘返。这100首诗词中毛泽东亲笔手迹66件，其余由34位书法家代书，每首诗是景，每一景又是诗，千姿百...毛泽东诗词碑林位于风景秀丽的韶峰半山腰，占地2万平方米，由100块汉白玉、花岗岩、大理石碑组成，按照毛泽东的革命生涯分为5个部分，按照时间顺序分为4个时期共收录毛泽东诗词100首，以纪念毛主席诞生100周年。碑林设计新颖、气势宏伟，100块诗词碑形状各异、依山走势、错落有致、雕刻精美，与毛泽东诗词的博大精深、雄浑气势相结合，又与韶峰的自然美景相辅相成，浑然一体，让人流连忘返。这100首诗词中毛泽东亲笔手迹66件，其余由34位书法家代书，每首诗是景，每一景又是诗，千姿百态、变幻万千，特别是碑林出口处的《七律·到韶山》这首光辉诗篇，是毛主席1959年回韶山所作，这块碑则是当今中国大的刻碑。,全年 8:00-17:00,https://img1.qunarzz.com/travel/poi/1806/f2/621180f386977e37.jpg_480x360x95_e34f5711.jpg,4.1,建议游览时间：1小时 - 2小时,,包含在韶峰景区门票内，通用于韶峰景区门票。,,2
平江起义纪念馆Pingjiangqiyi Memorial Hall,http://travel.qunar.com/p-oi718014-pingjiangqiyijinianguan,,,,https://img1.qunarzz.com/piao/fusion/1609/ae/839c15d6cb915c02.jpg_480x360x95_0ef0b7a4.jpg,0.0,,,具体收费情况以现场公示为主,,2
松山一号楼,http://travel.qunar.com/p-oi711801-songshanyihaolou,,位于韶山冲，距离毛泽东故居1公里。在一片苍松翠竹之中，沿路而上，经过一座小桥，由此进入松山。在竹林中显出一圆形拱门，上书毛泽东手体“故园”，这就是松山一号了。从拱门进去，只见古松遮天盖日，樟木苍翠欲滴，小鸟林间欢唱，微风迎面送来阵阵幽香。松山一号楼就在这里依山傍水而立，名为楼，实为青砖青瓦外表普通的平房。一号楼建于1958年，面积500多平方米，有卧室、会客室、理发室、餐厅、娱乐室等，所有设施一应俱全。 1959年6月25日，毛泽东乘一辆灰色吉姆车驶入松山一...位于韶山冲，距离毛泽东故居1公里。在一片苍松翠竹之中，沿路而上，经过一座小桥，由此进入松山。在竹林中显出一圆形拱门，上书毛泽东手体“故园”，这就是松山一号了。从拱门进去，只见古松遮天盖日，樟木苍翠欲滴，小鸟林间欢唱，微风迎面送来阵阵幽香。松山一号楼就在这里依山傍水而立，名为楼，实为青砖青瓦外表普通的平房。一号楼建于1958年，面积500多平方米，有卧室、会客室、理发室、餐厅、娱乐室等，所有设施一应俱全。 1959年6月25日，毛泽东乘一辆灰色吉姆车驶入松山一号，在这里度过了难忘的两天。在这两天里，他充分享受了故乡山水的芬芳，并在餐厅设宴招待父老乡亲，与故乡的乡亲畅怀叙情，了却浓浓的乡情。,,,--,,,,,3
秋瑾故居Qiu Jin Former Residence,http://travel.qunar.com/p-oi704505-qiujinguju,"

地址:
湘潭市雨湖区中山路404号

",辛亥革命烈士秋瑾之故居，位于由义巷内的“义源当铺”秋瑾在这里度过了八个春秋，并生育一男一女。秋瑾名闺瑾，字璇卿，小字玉姑，号旦吾，别号竞雄，自称鉴湖女侠，笔名汉侠女儿、秋千。原籍浙江绍兴县，生于福建厦门。她少年时期，由母单氏授以家学。1894年其父任湘乡县督销部办，她亦随父来到湘乡，并于1896年与当地乡绅王廷钓结婚。由义巷的“义源当铺”就是王家开设的。秋瑾在湘潭居住期间，一边哺育儿女，一边习剑练武，同时还写过许多反映自己对封建包办婚姻不满，忧时愤世的诗篇。如《咏琴》：“手抱绿绮来，七弦发清响，但恐所好殊，不遇知音赏。”《谢道韫》“咏絮辞何敏，清才扫俗氛。可怜谢道韫，不嫁鲍参军。”《踏青记》：“曲经珊珊芳草茸、相携同过小桥东。一湾流水无情甚，不送愁情送落红。”《杞人忧》诗：“幽燕烽火几时休，闻道中洋战未收，膝室空怀忧国恨，谁将巾帼易兜鍪。”王延钧通过父亲与曾国藩的姻亲关系，捐了个户部主事的京官。1900年夫妻携刚满3岁的孩子德源赴京，随后八国联军攻陷北京，清廷腐败无能，屈膝求和，签订了丧权辱国的《辛丑条约》，以求得苟且偷安。为避战祸，夫妻只得回到湘乡荷叶塘。1903年秋瑾随丈夫王廷钧第二次赴京，她目睹了帝国主义列强在中国的领土上的丑恶行径，更加激起了她满腔义愤，恨不得立刻跃马横刀，效命疆场，以身报国，曾写道：“身不得，男儿列；心却比，男儿烈”。1904年，秋瑾终于冲破了封建家庭的束缚，毅然东渡日本，寻求救国救民的真理。在日本结识了刘道一等一大批革命志士，于1905年9月加入同盟会，被推为同盟会浙江分会会长。1906年返回祖国，次年元月在上海创办《中国女报》发表了系列革命文章与诗作，为中国妇女解放运动奔走呼号，成为我国妇女解放运动的先驱。1907年春，秋瑾返潭小住，不久回到绍兴大通学堂主持教务，以此为据点，联络浙江、安徽等地的革命力量，并决定在两省同时起义，互相配合，攻取南京。为武装斗争曾立誓言：“我今必必必兴师，扫荡毒雾见青天，手提白刃觅民賊，舍身救民是全贤！”后因安徽革命党人徐锡麟刺杀巡抚恩铭被俘就义，事机暴露，清兵包围了大学堂，秋瑾英勇搏斗终因寡不敌众被捕，于1907年7月15日在绍兴英勇就义。就义后，灵柩曾一度停厝昭山，1912年其后人将其归葬西湖。孙中山在祭奠时为她作挽联致哀：“江户矢丹忱，感君首赞同盟会；轩亭洒碧血，愧我令招侠女魂。”并亲笔题赠：“巾帼英雄”的扁额。“义源当铺”在解放后被湘潭市开关厂作为厂房和职工住房，经过几十年的风雨变迁，现作为文物保护单位的房子，为原“义源当铺”的配房。,全天,https://img1.qunarzz.com/travel/poi/1803/25/7dfa20b36601a837.jpg_480x360x95_e87a1cce.jpg,3.9,建议游览时间：1小时,,具体收费情况以现场公示为主,,3
韶山军博园,http://travel.qunar.com/p-oi39640404-shaoshanjunboyuan,,韶山军博园基地是一个以博览军事知识，增强国防意识为主题的全年运行的综合性生态公园式国防军事教育基地。,,,0.0,,,,,3
韶山村,http://travel.qunar.com/p-oi39608630-shaoshancun,,,,,0.0,,,,,3
鹅洲岛,http://travel.qunar.com/p-oi39316164-ezhoudao,,,,,0.0,,,,,3
韶山烈士陵园,http://travel.qunar.com/p-oi39314959-shaoshanlieshilingyuan,,,,,0.0,,,,,3
白鹭村,http://travel.qunar.com/p-oi38922022-bailucun,,,,,--,,,,,3
木鱼湖湿地公园,http://travel.qunar.com/p-oi38629126-muyuhushidigongyuan,,,,,--,,,具体收费情况以现场公示为主,,3
湘潭樱花园,http://travel.qunar.com/p-oi38596360-xiangtanyinghuayuan,,湘潭樱花园，位于湖南省湘潭市岳塘区昭山镇七星村。是以樱花为主题的生态休闲型旅游地，栽种红粉佳人、中国红、八重樱、香水樱等各种樱花数千株。田园花水相映，樱花如云似霞。,,,4.6,,,,,3
碧泉湖公园,http://travel.qunar.com/p-oi38359324-biquanhugongyuan,,,,,0.0,,,具体收费情况以现场公示为主,,3
杨梅洲,http://travel.qunar.com/p-oi38340555-yangmeizhou,,,,,4.5,,,具体收费情况以现场公示为主,,4
窑湾历史文化街区,http://travel.qunar.com/p-oi38135676-yaowanlishiwenhuajiequ,,,,,5.0,建议游览时间：2小时 - 3小时,,,,4
镇湘楼,http://travel.qunar.com/p-oi37807056-zhenxianglou,,,,,--,,,具体收费情况以现场公示为主,,4
观湘门,http://travel.qunar.com/p-oi36451454-guanxiangmen,"

地址:
湘潭市雨湖区沿江中路

","观湘门位于湘潭，背靠湘江，是一座非常壮观的建筑，建筑两旁种植了很多绿植，登顶可以欣赏湘江美景。
",全天,,4.0,建议游览时间：1小时,,,,4
东方红广场,http://travel.qunar.com/p-oi36398161-dongfanghongguangchang,"

地址:
湘潭市岳塘区芙蓉中路24号

",东方红广场位于湘潭市岳塘区。广场上有雕塑，可以了解历史文化知识。广场景色宜人，风景优美，是人们喜欢活动的地方。,全天,,5.0,建议游览时间：2小时 - 3小时,,具体收费情况以现场公示为主,,4
毛泽东遗物馆,http://travel.qunar.com/p-oi36376543-maozedongyiwuguan,"

地址:
湖南省湘潭市韶山市韶峰路西50米毛泽东遗物馆

",,全年 09:00-16:00,,--,,,,,4
韶山宾馆故园一号楼,http://travel.qunar.com/p-oi36313046-shaoshanbinguanguyuan,"

地址:
湘潭市韶山市故园路16号

",韶山宾馆故园一号楼位于韶山宾馆内，1958年工程竣工，建筑面积600余平方米。时称韶山内部招待所，是韶山招待所(韶山宾馆的前身)的一部分。建房之前，这里的地名是芦家湾，位于韶山松山山麓，前面有梯田、水塘、枫树、左边有楠竹林，右边有茶园，是一个很美的地方。故又称作松山一号楼。1959年6月25日毛主席回韶山时下榻于此，并在此写下了《七律·到韶山》，根据毛主席诗词中提到的“故园”，人们后来又把这里称作故园一号楼。,全年 09:00-17:00,,5.0,,,具体收费情况以现场公示为主,,4
和平雕塑,http://travel.qunar.com/p-oi36300187-hepingdiaosu,,,,,4.3,,,,,4
和平广场,http://travel.qunar.com/p-oi36300177-hepingguangchang,,和平广场位于和平公园内，广场不是很大，正中有一个圆形水池，池中央有一座抽象的和平鸽雕塑，点明了和平的主题。,,,4.3,建议游览时间：1小时,,,,4
和平亭,http://travel.qunar.com/p-oi36300171-hepingting,,,,,4.5,,,,,4
湘砚博物馆,http://travel.qunar.com/p-oi36295934-xiangyanbowuguan,,湘砚博物馆位于湘潭市雨湖区，以水而建，环境清幽。馆内主要展出从原始社会到宋代、清朝等时代的砚台，并且定期会举行雅集、书画、茶道、香道等活动。,,,4.0,建议游览时间：1小时 - 2小时,,具体收费情况以现场公示为主,,5
韶山毛泽东同志纪念馆（专题展区）,http://travel.qunar.com/p-oi36283301-shaoshanmaozedongtong,"

地址:
湘潭市韶山市韶山冲

",韶山毛泽东同志纪念馆（专题展区）为全国爱国主义教育示范基地“一号工程”韶山核心建设项目，于2008年12月25日建成开放，现有展览《风范长存—毛泽东遗物展》、《大笔乾坤—毛主席诗文书法》、《英烈忠魂—毛主席一家六烈士》和《永远的缅怀》等，共展示毛泽东文物10008件。,全年 09:00-16:00,,0.0,建议游览时间：1小时 - 2小时,,,,5
韶山毛泽东同志纪念馆（生平展区）Shaoshan Mao Zedong Memorial Museum,http://travel.qunar.com/p-oi36283282-shaoshanmaozedongtong,"

地址:
湘潭市韶山市韶山冲


电话:
0731 5568 2398

",韶山毛泽东同志纪念馆生平展区，2013年即毛泽东同志120周年诞辰之际完成改造，正式对外开放。现有基本陈列《中国除了个毛泽东》，并定期推出特别展览。,全年 08:00-17:00,,0.0,建议游览时间：1小时 - 2小时,,,,5
韶山党史陈列馆,http://travel.qunar.com/p-oi36160232-shaoshandangshichenlie,"

地址:
湘潭市韶山市韶山冲路‎毛泽东纪念馆内

",韶山党史陈列馆讲述了韶山特支从成立到改革开放以来的光辉历史。,具体开放时间请咨询景区,,--,建议游览时间：1小时 - 2小时,,首道大门票收费情况请咨询景区,,5
天主堂,http://travel.qunar.com/p-oi36149647-tianzhutang,,"天主堂的大门是灰色的，门框上有一个很大的黑色十字架，“天主堂”匾额与门两侧的对联都是黑底白字。
",,,3.0,建议游览时间：1小时 - 2小时,,具体收费情况以现场公示为主,,5
湘潭失恋博物馆Xiangtan Museum of Broken Relationship,http://travel.qunar.com/p-oi35866889-xiangtanshilianbowuguan,"

地址:
湘潭市岳塘区建设路口湘潭中心一楼

",每一样看似普通的展品背后，都藏着一段扎心的爱情。慢慢褪色的电影票根、学生时期写满情话的书信、还有房门钥匙……馆里各种小道具解锁湘潭室内拍照新地标！,暂停营业,,0.0,建议游览时间：1小时 - 3小时,,具体收费情况以现场公示为主,,5
"湘潭县易俗河镇双梅村甘霖寺Ganlin Temple, Shuangmei Village, Yisuhe Town, Xiangtan County",http://travel.qunar.com/p-oi35678715-xiangtanxianyisuhezhen,,,,,--,建议游览时间：1小时 - 2小时,,具体收费情况以现场公示为主,,5
壬子桥Renziqiao Village,http://travel.qunar.com/p-oi35678645-renziqiao,,,,,--,,,具体收费情况以现场公示为主,,5
壬寅塘Renyintang Village,http://travel.qunar.com/p-oi35678453-renyintang,,,,,--,,,,,5
毛泽东广场-休息廊,http://travel.qunar.com/p-oi35645100-maozedongguangchang_xiu,,,,,5.0,建议游览时间：0.5小时 - 1小时,,,,5
毛主席铜像广场,http://travel.qunar.com/p-oi35441884-maozhuxitongxiangguang,,坐落在毛泽东纪念馆和毛氏宗祠前的开阔地带。周围青松翠竹掩映，群山拱护。铜像身躯高大，体态稳健，面带微笑而又沉思，成功地塑造了领袖在开国大典时的伟人风采。铜像基座上，镌刻着江泽民题写的“毛泽东同志”5个贴金大字。席铜像是按主席在开国大典上的形象设计的，坐西南、朝东北，主席身躯伟岸，手执发言稿，身着中山装，双目炯炯，微露笑容，神采奕奕。铜像高6米、重3.7吨，红花岗石基座高4.1米，全高10.1米。 据介绍，毛泽东广场作为人民群众表达对毛主席崇敬、追思、纪念的主...坐落在毛泽东纪念馆和毛氏宗祠前的开阔地带。周围青松翠竹掩映，群山拱护。铜像身躯高大，体态稳健，面带微笑而又沉思，成功地塑造了领袖在开国大典时的伟人风采。铜像基座上，镌刻着江泽民题写的“毛泽东同志”5个贴金大字。席铜像是按主席在开国大典上的形象设计的，坐西南、朝东北，主席身躯伟岸，手执发言稿，身着中山装，双目炯炯，微露笑容，神采奕奕。铜像高6米、重3.7吨，红花岗石基座高4.1米，全高10.1米。 据介绍，毛泽东广场作为人民群众表达对毛主席崇敬、追思、纪念的主要场所，其纪念性大于休闲性，因此突出了庄严、肃穆的纪念氛围。层次和区域。为瞻仰、参观、纪念和休闲等四个层次和区域。,,,--,,,,,6
坛山咀Tanshanzui Village,http://travel.qunar.com/p-oi35320362-tanshanju,,,,,--,,,具体收费情况以现场公示为主,,6
洪塘湾Hongtang Bay,http://travel.qunar.com/p-oi35306221-hongtangwan,,,,,--,,,具体收费情况以现场公示为主,,6
矮子洲Aizizhou Village,http://travel.qunar.com/p-oi35303217-aizizhou,,,,,--,,,具体收费情况以现场公示为主,,6
染房里Ranfangli Village,http://travel.qunar.com/p-oi35303162-ranfangli,,,,,--,,,具体收费情况以现场公示为主,,6
花子湾Huaziwan Village,http://travel.qunar.com/p-oi35300572-huaziwan,,,,,--,,,具体收费情况以现场公示为主,,6
楠竹塘Nanzhutang Village,http://travel.qunar.com/p-oi35292193-nanzhutang,,,,,--,,,具体收费情况以现场公示为主,,6
楠竹塘Nanzhutang Village,http://travel.qunar.com/p-oi35290187-nanzhutang,,,,,--,,,具体收费情况以现场公示为主,,6
